{
  "$schema": "./learned-patterns.schema.json",
  "version": "3.0",
  "last_analysis_chapter": 0,
  "last_analysis_date": null,
  "total_chapters_learned": 0,
  "auto_trigger_enabled": true,
  "high_point_preferences": {
    "favorite_types": [
      "职场打脸",
      "关系误判",
      "阶段性职业兑现"
    ],
    "type_weights": {
      "职场打脸": 1.4,
      "关系误判": 1.2,
      "阶段性职业兑现": 1.5
    },
    "typical_interval": 900,
    "trigger_patterns": {
      "optimal_suppression": "2-4段现实压力后换账",
      "explosion_style": "会议室或私域同场反转"
    },
    "avoided_types": [
      "无职场利害的糖点",
      "甲方乙方边界直接失真",
      "一章拿完事业和感情全部收益"
    ]
  },
  "dialogue_style": {
    "tone": "克制、带锋芒、少废话",
    "average_length": 14,
    "sample_phrases": [],
    "avoided_phrases": [
      "他好温柔",
      "她心里一颤"
    ],
    "character_voices": {
      "姜栀": "先讲事实，再讲底线",
      "裴述": "话少，判断直接，不轻易给承诺"
    }
  },
  "writing_patterns": {
    "chapter_opening_style": "压力先行",
    "chapter_ending_style": "留下未结清的账",
    "description_density": "中等",
    "battle_description": {
      "style": null,
      "detail_level": "低"
    },
    "emotion_description": {
      "style": "动作和对话带情绪",
      "inner_monologue_ratio": 0.22
    }
  },
  "vocabulary_preferences": {
    "favorite_words": [
      "复盘",
      "续约",
      "试运行",
      "预算"
    ],
    "avoided_words": [
      "不禁",
      "猛然",
      "顿时",
      "宠溺"
    ],
    "sentence_pattern": "短句推进，关键处停顿",
    "ai_trace_score": 0.0
  },
  "chapter_structure": {
    "dialogue_ratio": 0.42,
    "description_ratio": 0.33,
    "inner_monologue_ratio": 0.25,
    "paragraph_style": "短段为主"
  },
  "strand_preferences": {
    "quest": 0.38,
    "fire": 0.3,
    "constellation": 0.32
  },
  "learning_history": [],
  "user_feedback": [],
  "metadata": {
    "created_at": "2026-03-24T04:49:31Z",
    "last_modified": "2026-03-24T04:49:31Z",
    "genre": "现代言情",
    "platform": "番茄"
  }
}
